best pay as you go sim card,720,0.00,0,0,0.00,36
best pay as you go sims,390,0.00,0,0,0.00,0
cheap pay as you go sim,1600,0.00,0,0,0.00,28
best pay as you go sim,5400,0.00,0,0,0.00,91
pay as you go sim card only,170,0.00,0,0,0.00,16
sim card only pay as you go,170,0.00,0,0,0.00,16
pay as you go sim offers,5400,0.00,0,0,0.00,22
sim card deals pay as you go,720,0.00,0,0,0.00,0
cheap mobile sim card,390,0.00,0,0,0.00,73
mobile sim card uk,1000,0.00,0,0,0.00,140
sim card for uk,14800,0.00,0,0,0.00,2400
pay as you go sim uk,2400,0.00,0,0,0.00,170
uk mobile sim card,1000,0.00,0,0,0.00,140
buy uk sim card,880,0.00,0,0,0.00,140
cost of sim card,12100,0.00,0,0,0.00,4400
sim card in uk,14800,0.00,0,0,0.00,2400
pre pay sim,4400,0.00,0,0,0.00,1600
pre pay sim card,1900,0.00,0,0,0.00,1000
buy pay as you go sim card,320,0.00,0,0,0.00,58
pay as you go sim card,22200,2.01,1.05,12.05,24.25,2400
pay as go sim,74000,0.00,0,0,0.00,4400
sim card pay,27100,0.00,0,0,0.00,4400
dual sim dual,3350000,0.00,0,0,0.00,49500
