best pay as you go sim card,720,0.00,0,0,0.00,36
best pay as you go sims,480,0.00,0,0,0.00,0
cheap pay as you go sim,1900,0.00,0,0,0.00,36
best pay as you go sim,5400,0.00,0,0,0.00,91
pay as you go sim card only,210,0.00,0,0,0.00,12
sim card only pay as you go,210,0.00,0,0,0.00,12
pay as you go sim offers,5400,0.00,0,0,0.00,28
sim card deals pay as you go,880,0.00,0,0,0.00,12
cheap mobile sim card,480,0.00,0,0,0.00,110
mobile sim card uk,1000,0.00,0,0,0.00,170
sim card for uk,18100,0.00,0,0,0.00,2900
pay as you go sim uk,2900,0.00,0,0,0.00,170
uk mobile sim card,1000,0.00,0,0,0.00,170
buy uk sim card,880,1.26,1,6.02,7.57,170
cost of sim card,12100,0.00,0,0,0.00,4400
sim card in uk,18100,0.00,0,0,0.00,2900
pre pay sim,5400,0.00,0,0,0.00,1600
pre pay sim card,2400,0.00,0,0,0.00,1300
buy pay as you go sim card,390,0.00,0,0,0.00,58
pay as you go sim card,22200,0.00,0,0,0.00,2900
pay as go sim,90500,0.00,0,0,0.00,5400
sim card pay,33100,0.00,0,0,0.00,4400
dual sim dual,3350000,0.00,0,0,0.00,60500
