dc hair laser removal washington,1000,0.00,0,0,0.00,720
hair removal washington dc,1600,0.00,0,0,0.00,1000
hair laser removal virginia,4400,0.00,0,0,0.00,3600
chicago hair laser removal,3600,0.00,0,0,0.00,2900
laser hair removal maryland,1900,0.00,0,0,0.00,1900
laser hair removal manhattan,1300,9.70,1,10.35,100.39,880
hair removal chicago,4400,5.09,1,4.1,20.88,3600
city hair laser new removal york,1600,0.00,0,0,0.00,1000
city hair new removal york,2400,0.00,0,0,0.00,1600
laser hair removal new york,14800,14.98,1,34.36,514.57,12100
hair removal new york,18100,0.00,0,0,0.00,14800
