dc hair laser removal washington,720,0.00,0,0,0.00,480
hair removal washington dc,1300,0.00,0,0,0.00,720
hair laser removal virginia,3600,0.00,0,0,0.00,3600
chicago hair laser removal,2900,0.00,0,0,0.00,2400
laser hair removal maryland,1900,0.00,0,0,0.00,1600
laser hair removal manhattan,880,0.00,0,0,0.00,720
hair removal chicago,4400,0.00,0,0,0.00,3600
city hair laser new removal york,1000,0.00,0,0,0.00,720
city hair new removal york,1600,0.00,0,0,0.00,1000
laser hair removal new york,12100,4.99,1.05,57,284.15,9900
hair removal new york,14800,0.00,0,0,0.00,12100
