dc hair laser removal washington,880,0.00,0,0,0.00,590
hair removal washington dc,1300,4.82,1,5.27,25.40,880
hair laser removal virginia,3600,0.00,0,0,0.00,3600
chicago hair laser removal,2900,0.00,0,0,0.00,2400
laser hair removal maryland,1900,0.36,1,4.11,1.48,1600
laser hair removal manhattan,1000,17.90,1,14.39,257.59,720
hair removal chicago,4400,4.65,1,9.46,43.97,3600
city hair laser new removal york,1300,0.00,0,0,0.00,880
city hair new removal york,1900,0.00,0,0,0.00,1300
laser hair removal new york,12100,10.94,1,63.68,696.92,9900
hair removal new york,18100,0.00,0,0,0.00,14800
