dc hair laser removal washington,720,0.00,0,0,0.00,480
hair removal washington dc,1000,0.00,0,0,0.00,720
hair laser removal virginia,3600,0.00,0,0,0.00,2900
chicago hair laser removal,2400,0.00,0,0,0.00,2400
laser hair removal maryland,1600,2.58,1.05,8.13,20.99,1600
laser hair removal manhattan,880,8.23,1.05,24.19,199.16,590
hair removal chicago,3600,0.00,0,0,0.00,2900
city hair laser new removal york,880,0.00,0,0,0.00,720
city hair new removal york,1300,0.00,0,0,0.00,1000
laser hair removal new york,12100,5.92,1.05,21.89,129.64,9900
hair removal new york,14800,1.71,1.05,14.31,24.44,12100
