dc hair laser removal washington,0,0,0,0,0,0
hair removal washington dc,0,0,0,0,0,0
hair laser removal virginia,0,0,0,0,0,0
chicago hair laser removal,0,0,0,0,0,0
laser hair removal maryland,135,15.64,1,9,140.72,135
laser hair removal manhattan,237,4.65,1,17.32,80.53,237
hair removal chicago,0,0,0,0,0,0
city hair laser new removal york,0,0,0,0,0,0
city hair new removal york,0,0,0,0,0,0
laser hair removal new york,397,6.71,1,22.23,149.25,397
hair removal new york,375,9.61,1,5.25,50.51,375
